title,description,appId
Lightning Alarm Weatherplaza,"Lightning Alarm will not only let you know if there’s going to be lightning, but it will also tell you where. \r\n\r\nThunderstorm movement and intensity is displayed on a simple, elegant map.  At a glance you can see how close lightning is allowing you to decide if you should stay outdoors or be safer inside.\r\n\r\nUsing the latest data from global weather models combined with high-resolution lightning data, Lightning Alarm is a highly reliable, predictive thunderstorm App that will provide accurate alerts if lightning is is close to you.  No matter what you’re doing this App will make sure that you’ll be safe if there’s lightning nearby \r\n\r\nKey features of Lightning Alarm\r\n\r\n- Thunderstorm movement and intensity forecasted up to 2 hours ahead\r\n- Message alert sent 15 minutes before lightning is expected at your location\r\n- Service uses high quality weather data combined with high-resolution lightning data to accurately predict when lightning will occur",com.meteoplaza.flash
Live Alert 19,"The new and improved Live Alert 19 brings the latest and best weather alerting technology to your device! \r\n\r\n* High-resolution radar down to the street-level view \r\n* 1-hour and 24-hour 'future radar' with user-controlled time bar \r\n* High-resolution visible and infrared-satellite imagery \r\n* Current weather updated multiple times per hour \r\n* Daily and hour-by-hour forecasts updated hourly \r\n* Ability to select alerts for 'current location' and multiple other user-chosen locations \r\n* A fully-integrated GPS for current location awareness \r\n* The fastest, most accurate lightning and thunderstorm alerts available \r\n* Notifies you when lightning is within 15 miles of your location \r\n* Thunderstorm alerts using the Baron Tornado Index that can give you advanced warning that severe weather is possible \r\n* The latest video and blog updates from The Weather Authority",com.localtvllc.livealert19
MAGMA Indonesia,"MAGMA Indonesia is an application that presents information and recommendations, as quasi real-time regarding geological disaster in Indonesia including Volcano, Land Movement, Earthquake and Tsunami. This application is developed independently by PNS Development Team at the Center for Volcanology and Geological Hazard Mitigation, Geological Agency, Ministry of Energy and Mineral Resources. MAGMA Indonesia was built to serve the people of Indonesia and the international community. MAGMA Indonesia is a newly developed breakthrough Indonesia in the context of geological disaster mitigation efforts.\r\n\r\nFeatures information:\r\n1. Information Volcano Activity (Volcanic Activity Report / VAR). This information is an early warning system for volcanic processed from the data reporting routine Observer Volcano and staff Mitigation of Volcanic Indonesia into information such as location maps, basic data, the data on visual observations and instrumental, the status of the activity level, recommendations for the residents and visitors who move around volcanoes, the name of the report's authors and source data.\r\n2. Information Eruption / Volcanic Ash to Flight (Volcano Observatory Notice for Aviation / Vona). This information is an early warning system for volcanoes to flight safety (national / international) which passes through the territory of Indonesia contains information map location and time of occurrence explosion / blast of volcanic ash, the color code (the alert level), the height of the eruption column, the direction of the spread of volcanic ash, authorship reports and data sources.\r\n3. Information status volcanic activity levels overall.\r\n4. Information and Response Earthquake / Tsunami (On Earthquake Response / ROQ) which presents the basic information such as a map of the location and time of occurrence, magnitude, depth, a symbol of the earthquake mechanism in the vicinity of an earthquake, the name of a nearby volcano and earthquake epicenter data sources. Other information that can be provided (but not always) in the form of earthquake intensity (MMI) and the response contains a description, condition of the area, mechanism, impact, and the name of the report's recommendations.\r\n5. Information and Land Movement incident response / Avalanche (mitigation of ground movement / SIGERTAN) containing information on a map location and time of occurrence, impact, conditions of the affected areas, the condition of the soil movement, appearance / dimensions, causes, recommendations authorship of reports and sources data.\r\n6. Press Release (Press Release). Geological disaster information presented in list form.\r\n7. Search the name of the location of geological disasters.\r\n8. Disaster Prone Areas Map Download Volcano, Earthquake and Tsunami and Vulnerability Zone Map and Map Potential Land Movement.\r\n\r\nInteractive features:\r\n1. Map of geological disasters which displays the distribution of site types of geological disasters including information include the distance between the position measuring algorithm Users with geological disaster site.\r\n2. Disaster Report (Community Reporting System). Media for the public to report geological disasters in the vicinity as well as derived from information / news reliable.\r\n3. Report of earthquakes were felt (Report of earthquake intensity / LINE). Media for the public to report earthquakes are felt.\r\n4. Geological Disaster Notification settings. Users can set the desired geological disaster notification in accordance with the hazard potential in the region.\r\n\r\nSource of data used MAGMA Indonesia applications:\r\n1. Center for Volcanology and Geological Hazard Mitigation (PVMBG), Geological Agency, Ministry of Energy and Mineral Resources (Baseline Data and Report Response)\r\n2. Meteorology and Geophysics (Location Earthquakes)\r\n3. The United States Geological Survey (Location Earthquakes)\r\n4. Deutsches GeoForschungsZentrum (Location Earthquakes)\r\n5. Global Centroid Moment Tensor (Mechanisms Earthquakes)\r\n6. Smithsonian Institution, Global Volcanism Program (Baseline)\r\n7. Open Street Map (Basemap)\r\n8. ESRI Mapserver (Basemap)\r\n\r\nAppreciation:\r\n2016 - The Ministry of Energy and Mineral Resources Innovation Award # 1 Best Application\r\n2017 - Top 99 RB Kemenpan Public Service Innovation",com.magma.pvmbg.magmaindonesia
Medical ID (premium),"Medical ID allows creating medical profiles that are accessible from the lock screen of your device. In case of emergency, the app enables quick access to vital information such as your allergies, blood type, medical contacts, etc. that are essential to attending first responders, medics, or medical staff having to take action. \r\n\r\nThis is the premium version of the app. It enables all features:\r\n\r\n • Quick access to medical information from your lock screen.\r\n • Emergency alert feature to send SMS in one click (with your estimated location).\r\n • Location sharing with emergency contacts even when the app is closed (for up to 24 hours or until you stop sharing).\r\n • Direct emergency contacts call from the lock screen without having to unlock.\r\n • Backup feature to trigger manually.\r\n • Body Mass Index (BMI) calculation.\r\n • Current location (address, GPS coordinates).\r\n • Compass.\r\n\r\nThe display and access of your medical information from your lock screen are made possible via an accessibility service to enable and that is part of the core features of the app. Once enabled, the accessibility service displays a widget over your lock screen. This widget helps people who have disabilities, or first responders in case of emergency, to take action and access medical data.\r\n\r\nIn emergency situations, a Medical ID could prove to be invaluable to attending medics or other medical personnel providing treatment. Do not wait, turn your Android device into a life-saving tool.\r\n\r\n<i>Terms of use:</i>\r\n<a href=""https://www.google.com/url?q=https%3A%2F%2Fmedicalid.app%2Feula&sa=D&sntz=1&usg=AOvVaw2XOb7pH9U83CrrXUgrzAo2"">https://medicalid.app/eula</a>\r\n<i>Privacy policy:</i>\r\n<a href=""https://www.google.com/url?q=https%3A%2F%2Fmedicalid.app%2Fprivacy&sa=D&sntz=1&usg=AOvVaw0R8_MBdMa50JeJ5hR9zgYi"">https://medicalid.app/privacy</a>\r\n\r\nNote that your medical information remains on your device. Thus, you are responsible for this information and its use. Requested permissions are used for the described features only, not to collect data against your will.\r\n\r\n<b>We recommend that you try out the <a href=""https://play.google.com/store/apps/details?id=app.medicalid.free"">free version</a> before purchasing the premium. Indeed, the app may not work properly on some devices running a customized Android version or making use of apps that ""clean up"" or kill other apps. The same may apply to devices with specific security settings.</b>\r\n\r\nPlease contact us by email if you have any questions, or file an issue at:\r\n<a href=""https://www.google.com/url?q=https%3A%2F%2Fissues.medicalid.app&sa=D&sntz=1&usg=AOvVaw0kwN6eWd-M0cjCt472X8K-"">https://issues.medicalid.app</a>\r\n\r\nYou can also help to translate or improve the translation of the app. If you are interested, please have a look at:\r\n<a href=""https://www.google.com/url?q=https%3A%2F%2Ftranslate.medicalid.app&sa=D&sntz=1&usg=AOvVaw2qPZG4_HX0lV5bCNdN072r"">https://translate.medicalid.app</a>",app.medicalid
Météo Marine,"METEO CONSULT, the leading independent weather forecast provider and marine weather specialist, provides forecasts developed and controlled by experienced meteorologists. \r\n\r\nWhether you are a boater, skipper, surfer, kite surfer, diver or a fisher, you will find all the forecasts you need in this app! \r\n\r\n• FORECASTS Live forecasts and 15-day forecasts over a dozen parameters \r\n>> Thousands of zones and spots in France and Europe: coastal areas, ports, anchorages, gliding spots, beaches and coves, diving and fishing spots and interior spots. Choose yours! \r\n>> Compare the forecasts of the most visited weather sources in France to help you decide \r\n>> Compare the weather of several spots if you are not sure about your destination \r\n>> Create your own spots and share them with your friends and family \r\n\r\n• TIDES Easily consult the coefficients, heights and times of the tides \r\n\r\n• INTERACTIVE MAPS with forecasts and warnings in case of gales and storms\r\n\r\n• SEMAPHORES\r\n>> Hour-by-hour survey of more than 300 buoys and beacons in France and Europe \r\n\r\n• FAVOURITES access your favourite marine zones and bulletins with a single click, and synchronize your favourites with the ones you have on the METEO CONSULT Marine website. \r\n\r\n• NOTIFICATIONS : set custom alerts via notifications \r\n\r\n• VIDEOS\r\n>> Bulletins updated up to three times a day and commented by our expert forecasters \r\n>> Satellite animations and precipitation radars",com.lachainemeteo.marine.androidapp
MeteoSwiss,"The MeteoSwiss App from the national weather provider. With weather forecasts, current measurements, a blog about weather and climate and natural hazard warnings. Including individualizable live tiles and zoomable maps. Save your favourit places in Switzerland and get the corresponding weather details and subscribe to the warning threshold and types of natural hazard warnings sent as push notifications.\r\n\r\nWeather forecasts\r\n• Clickable and zoomable map with overview of locations for the next 6 days\r\n• Weather on-site\r\n• Wind / temperature at different altitudes\r\n• Text forecast for three climate regions of Switzerland including driving conditions and possible development of the weather situation for the following week \r\n  (in German, French and Italian)\r\n• General weather map of Europa\r\n\r\nWeather animations\r\n• Precipitation, precipitation type, temperature and cloud coverage, with realtime and forecast slide-function\r\n• Satellite images\r\n• Hail reports\r\n\r\nNatural hazards\r\n• All warnings on natural hazards from the Federal Authorities (severe weather, floods, forest fire, earthquakes and avalanches)\r\n• Clickable and zoomable map with overview of warning areas\r\n• Natural hazard bulletin\r\n• Location, type of warning and alarm threshold subscription, output as a push message\r\n\r\nCurrent weather\r\n• Clickable and zoomable map with overview of stations\r\n• Various measured data, updated up to every 10 minutes\r\n  \r\nFavorites\r\n• Available for all Swiss locations\r\n• Detailed overview of measurements, forecasts and warnings\r\n• Subscription to natural hazard warnings\r\n\r\nHealth\r\n• Air quality\r\n• Pollen forecast\r\n• UV index\r\n\r\nBlog\r\n• Daily updated information on weather and climate\r\n\r\nAviation Weather\r\n• METAR/TAF Switzerland\r\n• Aviation weather warnings Switzerland\r\n• Windanimations Switzerland on different FL\r\n• GAFOR Switzerland\r\n• Text forecasts for powered flight, gliding and ballooning\r\n• Low Level SWC Alps and Europe\r\n• Pressure difference\r\n• QNH – Chart\r\n• W / T – Chart\r\n• Wind – Barbs\r\n• Regtherm\r\n• Trajectories\r\n• Emagramms\r\n\r\nHomescreen\r\n• Tiles are personalisable in selection, size and placement",ch.admin.meteoswiss
MGP Tsunamis,"With the implementation of the National Tsunami Warning Center of the Navy of Peru you will know the following:\r\n\r\n- Display of the Flood Zones of the Peruvian coast, these areas are shaded in two colors: pink and red. These are simulations of tsunamis caused by earthquakes of different magnitude.\r\n- Display of National Seismic Report in which the past earthquakes in the country and abroad are detailed.\r\n- Download flood of letters available.\r\n- Prevention Tips to know what actions to take in case of Tsunamis.\r\n- Videos and useful information about the role of the National Tsunami Warning Center.",me.doapps.appdhn
Mobile County EMA App,"MCEMA is an interactive mobile app designed to assist the citizens and visitors of Mobile County, Alabama before, during, and after an emergency or disaster, whether natural or manmade.\r\n\r\nThe app provides various features that strive to help keep the citizens of Mobile County educated, prepared, and informed on preparedness and protective measures. Such features include: weather notifications, shelters, emergency kit check lists, social media feeds, and much more.\r\n\r\nAlthough we cannot always predict when emergencies or disasters will occur, every individual, family, business, and community must do their part to ensure they are prepared.\r\n\r\nDisclaimer: This app is NOT intended to replace your primary means of emergency notification or replace 9-1-1 in the event of an emergency. If you experience an emergency, please dial 911!",com.ocv.mobilecountyema
M-Protect Secure,Manage the security environment of your vehicles and their cargo in the M-Protect Secure App. \r\nDepending on what security solution installed on your vehicles and/or their cargo space you can manage who has access to your cargo where and when.,com.mprotect.mprotectsecure
My Hurricane Tracker & Alerts,"My Hurricane Tracker gives you the most comprehensive tools for tracking tornadoes, cyclones, tropical storms and weather warnings available. In a beautiful interface, you won't be overwhelmed with cluttered screens like you might with other apps. We give you exactly what you need in an easy to understand way.\r\n\r\n- Interactive tracking maps for each hurricane.\r\n- NOAA forecast map & storm satellite imagery where available!\r\n- Historic search of previous storms from 1851 (or 1949 for Pacific).\r\n- Receive weather warnings from the National Weather Service.\r\n- Push notifications for weather warnings or when new storm formations are detected!\r\n- Radar, satellite and sea temperature images automatically updated in the app!\r\n- See an outlook for the next 5 days from the NOAA.\r\n- Track specific hurricanes and receive notifications every time they are updated just by pressing the notify button!\r\n\r\nIt is similar to apps such as Hurricane Tracker, Hurricane Pro and Storm by Weather Underground. This version is ad-supported.",com.jrustonapps.myhurricanetracker
My SOS Family Emergency Alerts,"Press one button or use your voice. \r\nWe instantly Call and send SOS alerts to your family, friends, or colleagues with details of the emergency you are facing, your location, and even connect you to 911 for assistance.\r\n\r\nWe help you face any emergency confidently with an easy-to-use fast service.\r\n\r\nThe easy-to-use emergency alert service that helps you avoid facing any emergency alone.\r\n\r\nGet fast help from people you know and trust, 24/7.\r\n\r\nOur alarm service is used and trusted by thousands of people globally and has been featured in the press and on TV.\r\n\r\n3 simple steps to improve your safety:\r\n1.	Download the My SOS Family Emergency Alerts App.\r\n2.	Add people you trust (SOS Family).\r\n3.	Test the service on yourself or others.\r\n\r\nWith My SOS Family Emergency Alerts you'll feel confident and be better prepared for any unknown emergency.\r\n\r\n-- 3 unique things that set this App apart from everyone else --\r\n\r\n1) Your alerts are instant and will get through.\r\nBecause unlike others who only text, we also CALL your emergency contacts. We know few people read a text at 3 am or when driving.\r\n\r\n2) Only the user needs this App, anyone can receive alerts.\r\nIt’s hard to believe but our emergency call service can even be triggered without this App and doesn't need data or a phone signal.\r\n\r\n3) We will only contact your emergency contacts in case of a real emergency, and we keep everyone updated so they know who is helping.\r\n\r\nCall for help, send SOS alerts use the safety alarm to emergency contacts & 911.  This App will work even if there is no WIFI or data.\r\n\r\n\r\n-- Feature Packed –\r\nThis App has lots of easy-to-trigger short-cuts and features like:\r\n\r\n- Hands-free voice activation for sending SOS alert. \r\n- Link and use your Alexa smart speaker to send SOS alert and call for help \r\n- Set the SOS timer to protect against risky situations,\r\n- Link and use your landline to trigger SOS alerts and call for help.\r\n- Video Conferencing for to see and talk to your emergency contacts. \r\n\r\nExplore the App settings and test and pick your favourite short-cut.\r\nThey’re designed to be easy-to-use by everyone.\r\n\r\n-- Wear OS --\r\nApp is available as a companion App for Wear OS devices, it runs independently on SIM-enabled wearable devices, but you must first download it on your phone.\r\n\r\n--- Accessibility API ---\r\nMy SOS Family Emergency Alerts App requires access to the Accessibility API to trigger alerts in response to Power Button Long Press events - Panic Button. \r\nMy SOS Family Emergency Alerts does not collect any personal information other than the location.\r\nMy SOS Family Emergency Alerts collects location data to send your latest location in alerts even when the app is closed or not in use.\r\n\r\nMy SOS Family Emergency Alerts' emergency call service is the easiest way to take responsibility for you and your family’s safety.\r\n\r\nDownload it today and improve your safety.\r\n\r\nAvoid facing an emergency alone, without an action plan.\r\n\r\nFeel confident & better prepared for any emergency with My SOS Family Emergency Alerts.",com.mysosfamily
myAlerts,"With the My Alerts app from AlertSense, you can receive life-saving emergency alerts from public safety agencies, advanced warning of severe weather and community notifications that impact you and your family.  \r\n\r\nMy Locations:  \r\nSimply add the locations that matter to you. For example, you could identify your home, your child’s school, where your aging parent resides, the university where your older child attends, and your office. When you travel, you can enable the app to monitor your current location in order to receive any emergency alerts issued for the city or area you are visiting.    \r\n\r\nTypes of Alerts I Can Choose to Receive:\r\n\r\nSevere Weather Alerts\r\nReceive advanced warning of severe weather when you or one of your locations is in the direct path of the storm. AlertSense receives feeds from the National Weather Service, automatically interprets the geographic area affected, and delivers targeted alerts immediately to app users when one of their locations falls within the impact area. You can tailor your alert settings by location, selecting the severity level for which you want to receive notifications. For example, you can choose to receive only the most severe weather warnings or all watches and advisories as well.\r\n\r\nPublic Safety Alerts\r\nReceive emergency alerts from public safety alerting authorities, notifying you of situations that threaten the safety of yourself or those you care about. Public safety alerts include events such as crime, active shooter, imminent danger, hazardous materials, wildfire, floods and the need for immediate evacuation.\r\n\r\nCommunity Notifications\r\nYou can also choose to receive notifications of events in your community that, while not life-threatening emergencies, still impact your daily life and commute, such as road closures and power outages.\r\n\r\nPlease Note:  If a location you enter is not currently covered by a public safety agency who utilizes the AlertSense Service, you will receive severe weather warnings but not public safety alerts or community notifications for that location. If your city or county does not currently utilize the AlertSense service, contact your local public safety organization and let them know that your community would benefit from this service.\r\n\r\nQuestions, Feedback or Feature Requests:  Please contact AlertSense at myalertsfeedback@alertsense.com or call us toll free at 877-840-2041",com.AlertSense.PublicApp
MyRadar Weather Radar Pro,"** MyRadar Ad Free does not sell user data to any third parties. ***\r\n\r\nMyRadar Pro is the ad-free version of the leading free radar app, MyRadar.\r\n\r\nIt is a fast, easy-to-use, no-frills application that displays animated weather radar around your current location, allowing you to see quickly what weather is coming your way. Just start the app, and your location pops up with animated weather!\r\n\r\nThe map has the standard pinch/zoom capability which allows you to smoothly zoom and pan around the United States and see what the weather is like anywhere.\r\n\r\nMyRadar shows animated weather, so you can tell if rain is headed toward or away from you, and how fast.\r\n\r\nIn addition to the free features of the app, a few additional in app purchases are available including real-time hurricane tracking - great for the start of hurricane season - as well as a professional radar pack, which enables more detailed views of individual radar stations.\r\n\r\nMyRadar is also available for WearOS devices!\r\n\r\nDownload MyRadar today and try it out!",com.acmeaom.android.myradarpro
Namola,"Stay safe, connected and protected with South Africa’s biggest and best mobile safety solution.\r\n\r\n* Get help from police, ambulance, fire department or traffic officers in any emergency, any time, anywhere\r\n* Share location with loved ones to keep each other safe\r\n* Get Smart Alerts when your loved ones start travelling or arrive safely\r\n\r\nAll of the above is available for free.\r\n\r\nAdditionally, with our optional Namola Plus service you can get Armed Response or Private Emergency Medical Services. We also offer standalone panic buttons for extra peace-of-mind.\r\n\r\nNamola: Safe by Choice, not Chance",com.sixthline.namola
Natural Disaster Monitor,"You can monitor natural disasters around the world, as published by the Global Disaster Alert and Coordination System - www.gdacs.org. The app shows the latest natural disasters like earthquakes, droughts, volcano eruptions, tropical cyclones, tsunamis and floods as color coded icons in a list as well as on a Google Maps backdrop; the icon colors indicate the alert level - green, orange, and red. The icon will look more transparent the older the event was published. Clicking on the item will bring up more details about the disaster event. UTM or geographic grids can optionally be displayed on the map.\r\n\r\n* Now with dark mode setting.",com.dom925.disastermon
News 8000 First Warn Weather,"News8000.com and WKBT StormTeam 8 deliver the latest weather and alerts for La Crosse, Wisconsin and your location.\r\n\r\nAccess your First Warn forecast, live radar, school closings, video forecast, weather alerts, and more!\r\n\r\nFEATURES:\r\n* Real-time weather alerts sent directly to your mobile device  \r\n* Current conditions for your location\r\n* 8-day and video forecast from the News 8 StormTeam\r\n* Live radar and satellite imagery with watch/warning overlays\r\n* Upload photos and video of weather from your phone.  We may share what you're seeing out there",com.wkbt.android.weather
