title,description,appId
SOS Alert | Emergency & Safety,"SOS Alert is an emergency app which helps you out whenever your safety is at risk by reaching out to your emergency contacts and providing them with your current location.\r\n\r\nFEATURES\r\n***********\r\n1. No Ads\r\n2. Very basic user interface and easy to use \r\n3. Dark theme\r\n4. In case of an emergency, a link of your current location on Google Maps is sent to your emergency contacts so that they can locate you accurately\r\n5. The Emergency Contacts and the SOS Message are stored locally on your device, therefore no one other than you have access to it\r\n6. You can edit the SOS Message and add other useful information about yourself\r\n7. SOS Widget for sending SOS Alert in just one tap\r\n\r\nHOW DOES IT WORK?\r\n***********************\r\n1. Whenever you are in an emergency, you need to press the SOS Widget or the SOS button in the app\r\n2. As soon as you press the button/widget, a countdown of 3 seconds starts immediately (you can cancel the SOS Alert if you want to, before the countdown ends)\r\n3. When the countdown ends, the app fetches your location from the GPS on your device and sends (through SMS) your location along with your SOS Message (which is pre-saved on your device) to the emergency contacts that you have registered in the app\r\n4. The registered emergency contacts receive your SOS Message and a link of your current location as an SMS from your mobile number",com.rghvsapp.android.sosalert
Panic button | SOS Safety App,Panic Button to be safe everywhere. It sends your location to your selected contacts with a customizable message.\r\n\r\nFeatures:\r\n- Send Panic SMS\r\n- Up to 10 trusted contacts\r\n- Emergency call\r\n- Possibility to send alert from the lock screen\r\n- Possibility to send alert by pressing the volume keys.\r\n- Whistle detector and clap detector to send alert\r\n- No ads\r\n- Customizable message\r\n- Customizable countdown to prevent accidental clicks\r\n- Widget,app.iggy.panicbutton2FreeVersion
SoSecure by ADT: Safety App,"SoSecure: Safety that’s mobile like you \r\n\r\nSome situations require emergency response in seconds. Other times, you just need someone looking out for you. With SoSecure, you can locate loved ones, discreetly contact ADT if you feel unsafe, or tell us when you want us to check on you. So, whether you’re exploring a new city, going running or on a first date, or just going about your day, you can go confidently.\r\n\r\nSoSecure Basic (Free) Includes:\r\n•	Location Sharing – Invite family & friends into groups to make check-ins easier and have peace of mind knowing you’re all safe. Save 3 ‘spots’ like home or school to get arrival and departure alerts.\r\n•	24x7 SOS Response from ADT – even if you can’t say a word.\r\n•	SOS Chat – Can’t talk? No problem. If it’s safe to do so, quietly share helpful details.\r\n•	SoSecure Widget – Request help faster from your locked screen.\r\n\r\nGet an added layer of protection with SoSecure Plus or Premium!\r\n\r\nSoSecure Plus ($4.99/mo. or $49.99/yr. + tax) includes all free features, plus:\r\n•	Location Sharing: Invite family & friends into groups to make check-ins easier and have peace of mind knowing you’re all safe. Save up to 50 ‘spots’ like home or school to get arrival and departure alerts.\r\n•	TrackMe: Set a timer for any activity and invite ADT to track you via GPS. If you don’t stop the timer and we can’t confirm you’re safe, we’ll alert 911 and your Guardians. Connect with ADT 24x7 for 'virtual walks'.\r\n•	Voice Activation: Use a secret phrase to request help if you don’t want anyone around to know. Or, say “Hey Siri, start a SoSecure emergency.”\r\n•	SOS Video: Livestream with an ADT agent so they can see you and your surroundings and send help.\r\n\r\nSoSecure Premium ($9.99/mo. or $99.99/yr. + tax) includes all SoSecure Plus features, plus:\r\n•	Location Sharing – Invite family & friends into groups to make check-ins easier and have peace of mind knowing you’re all safe. Save up to 100 ‘spots’ like home, school, or work to get arrival and departure alerts.\r\n•	Roadside Assistance: Dead battery? Flat tire? Need gas or a tow? We’ll send help to your location to get you going.\r\n•	Crash Detection: When we detect a crash, we’ll check on you and send help if you need it.\r\n\r\nSubscription Pricing & Terms\r\n*SoSecure Plus Subscription: $4.99/mo. or $49.99/yr. + tax. Includes 30-day free trial. Subscription auto-renews after free trial ends at the term/pricing selected. First charge is 30 days after trial starts. Turn off auto-renewal by going to your iTunes Account Settings. To avoid being billed, you must turn off auto-renew at least 24 hours before the trial expires. No refunds for any unused portion of the current period. SOS response is available in all 50 U.S. states and D.C., except Milwaukee. For SoSecure to work, your phone must be powered on and fully functional. Notifications must be allowed for SoSecure, so you can receive real-time emergency updates. Enabling features like Focus on iOS will silence alerts.\r\n\r\n*SoSecure Premium Subscription: $9.99/ mo. or $99.99/yr. + tax.\r\n*Roadside services provided by Cross Country Motor Club, Inc., not ADT. Includes Towing, Roadside Service coverage (jump start, battery charge, flat tire, fuel delivery up to 2 gallons free, lockout, winch-out within 10’ of a paved road.\r\n\r\nSeverity Coverage: For towing events, coverage up to 10 miles from disablement location; for roadside services, coverage up to $100\r\n\r\nFrequency Coverage: For all coverages, up to 4 services/yr., service must be initiated via the SoSecure app to be covered. Limited to passenger cars and light trucks, not trailers, large trucks, RVs, campers or anything already being towed. Roadside Assistance isn’t an automobile insurance policy, and ADT isn’t an insurance carrier.\r\n\r\nIt takes up to 24 hours from purchase to enroll your vehicle in Roadside Assistance services through our third-party service provider and services will not be available during that time. \r\n\r\nTerms of Service - https://www.adt.com/about-adt/legal/sosecure-terms-of-service",com.adt.sosecure.android
Station Monitor,Explore earthquakes near you or from around the globe using the new EarthScope Station Monitor app! Select from hundreds of seismic stations throughout the world. View up-to-the-minute recorded ground motions or see recordings from previous days and past events. Get information about recent events and choose to annotate wave arrivals.,edu.iris.app.stationmonitor
Storm Shield,"Severe weather alerts for your exact location. Storm Shield gives you storm-based alerts for tornado, hurricane, flood, thunderstorm, winter storms and other life-threatening weather events via voice and push notification.\r\n\r\nStorm-based alerts help reduce false alarms by alerting you to severe weather based on your exact location within a county. County-based alerts can result in false alarms, warning you when your location in the county is not within the threatened area.\r\n\r\nThese features come with your app download:\r\n\r\nBenefits:\r\n• Get voice alerts just like a NOAA weather radio via push notification anywhere in the United States.\r\n• Hi-Def radar map is your home screen so you can quickly see what's going on at your locations.\r\n• View current conditions, hourly and daily forecasts.\r\n• Save additional locations to ensure family members stay safe.\r\n\r\nView NOAA severe weather alerts on the map to see where dangerous weather is happening:\r\n• Tap alerts to view info\r\n• Show multiple severe weather layers on the map at the same time\r\n• Flood watches & warnings\r\n• Tornadoes & Thunderstorms\r\n• Hurricane & Tropical Storm forecast tracks\r\n• Winter storms\r\n• Marine & Coastal alerts\r\n• Radar & Clouds\r\n• Wind Speed\r\n• Snow Fall\r\n• Road Weather\r\n\r\n\r\nEnhance your app with auto-renewing subscriptions:\r\n\r\n• Buy Premium Weather ($0.99 per month) to unlock these 3 features:\r\n1) Future Radar - See forecasted radar imagery.\r\n2) Future Temperature Map - See forecasted temperature map.\r\n3) Storm Tracks - See how fast storms are moving and where in the next few minutes.\r\n\r\n• Buy Lightning ($0.99 per month) to unlock these 2 features:\r\n\r\n1) Get push notifications for lightning strikes near your locations.\r\n2) See lightning on the map within 100 miles of a selected location.\r\n\r\nNote:\r\n• Payment will be charged to your Google Play Account at confirmation of your purchase.\r\n• Subscription automatically renews unless auto-renew is turned off before the end of the current period.\r\n• Subscriptions may be managed by the user and auto-renewal may be turned off by going to the Google Play Store menu and selecting 'Subscriptions' after purchase.\r\n• After a free trial ends (if offered), your subscription will automatically convert to a paid subscription. You may cancel your subscription before your free trial is up to avoid being charged.\r\n• Privacy Policy: https://www.stormshieldapp.com/privacy_stormshield_wxs.html\r\n• Terms of Use: https://www.stormshieldapp.com/terms_stormshield_wxs.html\r\n\r\nStorm Shield is made possible by The E.W. Scripps Company.\r\n\r\nView help and tips at support.stormshieldapp.com.",com.wdtinc.android.stormshield
Swift911 Public,"Swift911 Public leverages the amazing power of SwiftReach's Swift911 Alerting Platform which is used by counties, cities, municipalities, emergency management, corporations and more!\r\n\r\nKeep yourself informed in case of any emergency with SwiftReach's FREE Swift911 Public mobile app.",com.ravemobilesafety.swift911public
TerrorMate,"TerrorMate is a location-based alert app designed to provide you with information during a major crisis situation. The app creates a structured mobile, real time, intelligence system that sends informative and factual terror alerts and safety guidelines during a terror attack or terror alert.\r\n\r\nIn any emergency, exchanging life-saving information is priority #1. TerrorMate™ ensures this exchange is immediate and reliable.\r\n\r\nFeatures\r\n\r\nAlerts - Location-Based real-time notifications in the event of an attack/alert\r\nIntel Feed - Gather critical information from our sources to keep you up to speed on events surrounding the threat. \r\nConnect - Communicate with your friends/family on our T-Chat instant messaging system.\r\nFollowMe - Share your location with friends/family by one touch or request another user’s location to ensure they are safe and follow their whereabouts on the map. Simply click on the location pin on your map menu.\r\nMedia - Share pictures & video of events directly on the app with our Control Room\r\n\r\nTerrorMate is a partner to the Department of Homeland Security FEMA Integrated Public Alerts and Warning System (IPAWS).\r\n\r\nTerrorMate alerts are available worldwide.",com.terrormate
Tornado - American Red Cross,"Get your family and home ready for a tornado. The American Red Cross tornado app is the complete solution you need to understand and prepare for a tornado and all that comes with it. With interactive quizzes and simple step-by-step advice it’s never been easier to be ready!\r\n\r\nAhora disponible en español.\r\n\r\nFeatures:\r\n• Easy to use Spanish language toggle to switch translation directly inside the app.\r\n• Audible siren when NOAA issues a Tornado warning for any of your monitored locations letting you know when it’s time to go to your safe room plus an all-clear alert when the warning expires (Note: Alerts' sounds will NOT override if phone is on vibrate or in sleep mode)\r\n• Simple step-by-step instructions to help you know what-to-do even if the cell towers and TVs are down. Prioritized actions for before, during, and after requires no mobile connectivity \r\n• Help distant friends and family in tornado alley with ability to receive tornado watch and warning alerts based on their location from NOAA \r\n• Red Cross location-based open shelters map for when you need it most \r\n• Be ready should a tornado hit by learning how to assemble an emergency kit for your family in the event of power outage or evacuation \r\n• Reduce your household’s stress and anxiety should a tornado hit by learning to make and practice an emergency plan \r\n• Interactive quizzes allow you to earn badges that you can share with your friends and show off your tornado knowledge \r\n• Know how many tornadoes have occurred in your area \r\n• Know the difference between a watch and a warning\r\n• Learn how to deal with food and water impacted by floods and power outages \r\n• Simply let friends/family know you’re safe with customizable “I’m Safe” notification sharable thru social media, text and email \r\n• Let others know where you are with the Toolkit’s strobe light, flashlight and audible alert functions\r\n\r\nPrivacy policy: http://www.redcross.org/privacy-policy \r\nEULA: http://www.redcross.org/m/mobile-apps/eula\r\n\r\nCopyright © 2013-2014 The American National Red Cross",com.cube.arc.tfa
TornadoSpy,"Lightning strikes the earth around 100 times per second.  Are you sure that the tornado sirens in your area will be in working order when the time comes? Stay safe with TornadoSpy+ featuring AccuSpy™ technology that gives you the power to report and view official and user spotted tornadoes or hail instantly.  It contains U.S. animated radar maps, push alerts, overlayed maps, warnings, tornado forecast maps, and radar snapshots of tornado sighting areas.  \r\n\r\n- Featured in the Joplin Globe on 5/20/12\r\n- Featured on the front page of USAToday on 5/31/11\r\n- Featured in the Fort Worth Star-Telegram on 6/16/11\r\n- Over 150,000 confirmed alerts sent out\r\n- Over 40,000 TornadoSpy spotters in addition to professional spotters from the national weather service.\r\n\r\nOn 5/10/10, a user spotted the Oklahoma City tornado 20 MINUTES before the NOAA report, which gave other users valuable lead time to escape the storm. This is a frequent occurrence since user reports are submitted and viewable immediately.\r\n\r\nSightings are filtered through state-of-the art AccuSpy™ technology to prevent false alerts and only send you the most accurate sightings.\r\n\r\nFeatures:\r\n- Track tornado/hailstorm movement worldwide on the built-in map\r\n- Report nearby tornadoes/hail with a simple touch\r\n- View HD radar, tornadoes, and hail overlayed on interactive maps simultaneously\r\n- Includes official tornado reports as well as tornado warnings from National Weather Service storm spotters\r\n- Real Time Push alerts\r\n- Email and text alerts \r\n- Share and view tornado/hail photos in seconds\r\n- Filter sightings by spotter ratings\r\n- View previous tornadoes/hail sightings\r\n- Write storm report notes\r\n- Users can rate sightings submitted by other users\r\n- Verify sighting reports with radar snapshots near report areas.\r\n- Radar loops\r\n- Tornado forecasts\r\n- Warning maps\r\n- AccuSpy™ state-of-the art storm spotting\r\n\r\nIn-app Purchases\r\n- US National Weather Radio\r\n- Animated Radar using FAST technology (TornadoSpy Exclusive)\r\n\r\nDownload now, and become a part of the fastest and largest worldwide storm spotting network.\r\n\r\nDemo video can be seen at justintimeapps.com/ss.html\r\n\r\nPrivacy policy:\r\nhttp://www.justintimeapps.com/policies.html",com.tornadospy.tornadospyapp
Travel Safe - World Emergency ,"This app is perfect for anyone who travels a lot to different countries and has not memorized all the different emergency numbers.\r\n\r\n🗺 DETECTS CURRENT LOCATION\r\nThe app detects your current location and immediately shows the specific emergency phone numbers for that country.\r\n\r\n🛡 FEEL SAFE ANYWHERE\r\nThe app includes the emergency numbers of all countries that you are likely to be traveling to.\r\n\r\n📡 WORKS OFFLINE\r\nThe very best thing is that this also works offline. This is absolutely fantastic when traveling and you don't have internet access.\r\n\r\n☎️ DIRECTLY CALL FROM THE APP\r\nSimply tap on the numbers and make the phone call. You don't want to lose precious time during an emergency.\r\n\r\n🌚 FAST AND BEAUTIFUL\r\nThe app is lightweight, fast and pleasing to the eye with support for Night Mode.\r\n\r\n🛑 NO ADS\r\nWe hate ads just like you do.",com.imperiumapps.emergencynumbers.travel.safe.world.emergency.phone.numbers
Veoci,"Veoci is a web-based software for managing communication and coordinating activities in crisis and emergency situations. Adopted by Universities, Enterprises, Municipalities, Utilities, and Airlines for standing up a quick response to address any situation from a Virtual Emergency Operations Center (EOC). For more information visit our website: http://www.veoci.com \r\n\r\nFeatures:\r\n- Create digitized plans that can initiate a structured response at the click of a button.\r\n- Alert and notify people on multiple mediums - Phone, SMS, and Email.\r\n- Request check-in for a status of resources available to respond.\r\n- Centralize communications in a Virtual Emergency Operations Center.\r\n- Get complete situational awareness with real time incident tracking and GIS mapping.",com.greywallsoftware.veoci
VicEmergency,"VicEmergency is the official Victorian Government app for emergency warnings and information. Download VicEmergency, set up a user profile and watch zones to ensure you receive official warnings and information for areas that interest you. \r\n\r\nWatch the VicEmergency video at www.youtube.com/channel/UCskGgVGdfEp1C3BMiiwAyzQ \r\nTo review support articles or submit a request, visit http://support.emergency.vic.gov.au\r\n\r\nMain Features:\r\n• Live incident map showing current warnings, planned burns and other types of incidents across Victoria.***\r\n• Simple to create a profile and use watch zones that ensure you get official warnings for your local area. Warnings and information* are pushed out to a user's phone when issued by Victoria’s emergency services. \r\n• GPS integration to determine your current location** and surrounding incidents. \r\n• Emergency Warnings, Warnings, Advice and information as issued by Victoria’s emergency services\r\n• Share incidents and warnings with friends and family.\r\n• View forecast Fire Danger Ratings on the map.\r\n• View today's and tomorrow’s Total Fire Ban status.\r\n\r\n* Your device must have an internet connection to receive warnings and information issued by Victorian emergency services. \r\n** To view your current location, GPS must be switched on and location functionality enabled.\r\n*** Map symbols represent the origin of the emergency, not its current location or spread.\r\n\r\nThe VicEmergency app is just one tool to assist you to access warnings and information about emergencies, however you should never rely on just one information channel. Emergency services use a range of other information channels including SKY TV, ABC local radio, some commercial and designated community radio stations, VicEmergency Hotline  on 1800 226 226, VicEmergency website on www.emergency.vic.gov.au and VicEmergency Twitter and Facebook.\r\n\r\nWhat's New in this Version?\r\n•	Addition of other types of emergencies e.g. flood, earthquake, storms, tsunami, shark sightings etc\r\n•	Addition of user profile so watch zones can be accessed across multiple devices\r\n•	Integration of user profiles and watch zones with the VicEmergency website\r\n•	Addition of landscape view for all screens\r\n•	Addition of custom tone for notifications\r\n•	Addition of edit function for all aspects of watch zones\r\n•	Addition of warning notifications by email\r\n\r\nAre you getting a message asking Allow ""VicEmergency"" to access to your location? You need to allow access to see incidents and warnings for your current location. The steps for this will vary depending on your device, model and version of android, but should be similar to this:\r\n•	Open device settings\r\n•	Select applications\r\n•	Select manage applications\r\n•	Choose VicEmergency from the list\r\n•       Tick the ‘show notifications’ box at the top of the screen",com.naturallybeing.fireready
Volcanoes & Earthquakes,"Volcanoes & Earthquakes shows the latest earthquakes worldwide or only quakes near you, as well as earthquake ""I-felt-it"" reports for earthquakes, in near real-time. It also shows active volcanoes on a map and as a list, along with volcano news from all the world.\r\nYou can filter and display the data in various ways, for example by magnitude or age of earthquakes, distance from your location, volcano status and much more.\r\n\r\nSUPPORT US!\r\n\r\nIf you like the app, please write us a 5-star review to support our premium ranking, which in turn will help us to keep on improving the app and developing it further. More features and upgrades are planned!\r\n\r\nFeatures:\r\n\r\n- See currently erupting volcanoes on a map (more than 1600 active and dormant volcanoes)\r\n- Get most recent volcano news, including volcanic ash advisories (starting from v.1.4.0)\r\n- See the most recent earthquakes around the world based on one of the most complete and accurate earthquake datasets on the internet – earthquakes worldwide up to 7 days old\r\n- Notifications: near-real time earthquake & volcano alerts\r\n- Custom alerts for user-set locations/areas\r\n- Detailed tectonic plates\r\n- 1000s of active faults\r\n- Alert if earthquakes might have been felt in your area\r\n- Larger earthquakes (above magnitude 6.0) available for up to 1 year\r\n- Listing of earthquakes near active volcanoes (could indicate volcanic unrest)\r\n- Complete volcano listing worldwide alphabetically/by country/by activity level (starting from v. 1.4.0)\r\n- Multiple data sources (more than 40 international and national data sources)\r\n- Filter earthquakes according to magnitude, age and distance\r\n- Filter quakes by continent, country or state (starting from v. 2.3.0)\r\n- Sort quakes by time (latest) or size (magnitude)\r\n- Earthquake archive since 2012 - arguably the most complete available on the web (starting from v. 2.3.0)\r\n- Earthquake stats – magnitude/energy/depth vs time or magnitude (starting from v. 2.4.0)\r\n- Submit/read/view user earthquake reports on map via the ""I felt an earthquake"" feature\r\n- Detailed information about each earthquake\r\n- Detailed information about each volcano including list of eruptions and manner of eruptions \r\n- Tectonic plate boundaries \r\n- Purpose-built and customized, highly compressed data format to save bandwidth\r\n- Optional automatic background loading of data \r\n- Submit a feature request through comments!\r\n\r\nUpcoming features:\r\n\r\n- More data sources to be added\r\n- Earthquake news\r\n\r\nMain earthquake data sources currently used:\r\n\r\n- British Geological Survey (BGS), UK\r\n- China Earthquake Information Centre (CEIC), China\r\n- Russian Academy of Science (Камчатский филиал Геофизической службы - EMSD), Russian Federation\r\n- European-Mediterranean Seismological Centre (EMSC), France\r\n- National Geographic Institute (Instituto Geográfico Nacional - IGN), Spain\r\n- Icelandic Met Office (IMO), Iceland\r\n- National Institute of Geophysics and Volcanology (Istituto Nazionale di Geofisica e Vulcanologia - INGV), Italy\r\n- Geoscience Australia (GeoAu)\r\n- New Zealand Earthquake Commission and GNS Science (GEONET), New Zealand\r\n- German Research Centre for Geosciences (Deutsches GeoForschungsZentrum Potzdam – GFZ), Germany\r\n- National Seismological Center of the University of Chile (Centro Sismológico Nacional, Universidad de Chile – GUG), Chile\r\n- Kandilli Observatory and Earthquake Research Institute-Regional Earthquake and Tsunami Monitoring Center (KOERI-RETMC/BOUN KOERI), Turkey\r\n- Natural Resources Canada (NRCAN), Canada\r\n- Philippine Institute of Volcanology and Seismology (PHILVOLCS), Philippines\r\n- Swiss Seismological Service (Schweizerischer Erdbebendienst. SED), Switzerland\r\n- Servicio Sismológico Nacional (SSN), Mexico\r\n- United States Geological Survey - Earthquake Hazards Program (USGS), USA\r\n\r\nDisclaimer:\r\nAlthough we take care to collect data from reputable sources and strive for accuracy, there is no guarantee that the information is correct or complete and that the app will always perform as intended.",com.volcanodiscovery.volcanodiscovery
Voyent Alert!,"Voyent Alert! is a smart notification service that enables users to receive critical event and general day-to-day communications from participating municipalities, regional governments and organizations.\r\n\r\nThe Voyent Alert! communications are customized for each user’s followed locations (e.g. ""Home"", ""Work"", ""Kid's School"", ""Mobile Phone""). Users can be provided with notifications containing greater situational context, such as direction and distance to a critical event based on their location as well as enriched media such as images, PDFs and hyperlinks to more information.\r\n\r\nVoyent Alert! provides concise information when you require it and ensures you are not saturated with notifications that are not relevant to you.\r\n\r\nStay Alert. Stay Connected.",com.icesoft.voyent.vras.android
