title,description,appId
Emergency,"An emergency is a situation that poses an immediate risk to health, life, property, or environment. Most emergencies require urgent intervention to prevent a worsening of the situation, although in some situations, mitigation may not be possible and agencies may only be able to offer palliative care for the aftermath.\r\n\r\nWhile some emergencies are self-evident (such as a natural disaster that threatens many lives), many smaller incidents require that an observer (or affected party) decide whether it qualifies as an emergency. The precise definition of an emergency, the agencies involved and the procedures used, vary by jurisdiction, and this is usually set by the government, whose agencies (emergency services) are responsible for emergency planning and management.",com.saidkamal.emergency
Emergency Alert,"Emergency Alert is a useful tool for alerting you to urgent events via notifications, even when your phone is on silent. You can even set up your own rules which can be triggered with notification messages from other apps that start or contain text. You can also control the volume of each alert and select different alert sounds, as well as use your own mp3s.\r\n\r\nA useful application for the following scenarios:\r\n- Business continuity\r\n- Urgent notifications from friends or family\r\n- Disaster notifications - Earthquakes, flood alerts and security threats. Please note however that the app does not provide alerts from your local emergency service providers after installation. If you receive alerts regarding tornadoes, flooding or earthquakes, you must manually create a rule to alert you when you receive these messages.\r\n\r\nThe application listens out for notifications that match the rules you have created - when triggered, the app can alert you one of three ways:\r\n\r\n- Silently - This alert simply displays a popup message containing the text of the notification.\r\n\r\n- Vibrate - This alert will vibrate until dismissed, allowing you to be quietly notified of an urgent matter.\r\n\r\n- Play Audio - This alert will alert you with a loud siren until dismissed, even if the device is on silent with media volume turned down.\r\n\r\nYou can also set up a rule to both play audio and vibrate. It's up to you!\r\n\r\nYou can create a rule based on the notification title or body, either starting with or containing text you enter as criteria.\r\n\r\nThe app is also intelligent - if you have a headset plugged in, it will use the current volume so you aren't deafened! Without headphones, the alert will play at full volume through the speaker, ensuring you won't miss an alert.\r\n\r\nPlease Note: The way your device displays notifications may mean that this app may behave differently on different handsets - please test on your device after installation to ensure it is working with your set up. \r\n\r\nFor example, some Samsung devices uses Samsung's built in messaging app which doesn't use Android notifications. You can workaround this issue by using the Android Messages app instead. Any app should work with Emergency Alert as long as it uses the standard Android notification system.",com.mccondach.emergencyalerts
Emergency Alert,"This app was created to send emergency alerts to anyone, including 911 for exteme emergencies. Pre design with help message and automatically send your location using google map to law enforcement .Always stay protected and safe anywhere with emergency alerts",com.na.emergencyalert
Emergency Alert,"The Emergency Alert app is perfect for anyone in an emergency or hazardous situation. The app contains a beautifully designed emergency flasher, emergency alarm, and emergency flashlight. All functions may be used to warn others of your situation and may also help in locating you. The app's settings are used to modify the emergency flasher colors and the strobe/blinking rate, and to select the emergency alarm sound such as air raid, siren, fire smoke alarm, etc.",com.madeeasyenterprises.emergencyalert
Emergency Alert,"The Emergency Alert app will allow users to receive timely information and updates through a unified multi-channel Emergency Alert System (EAS) that will enable the issue of timely, coordinated and efficient distribution of alerts, warnings and advisories to the general public and key stakeholders in times of emergencies/disaster.\r\n\r\nThis application has been developed for the citizens of the Republic of Mauritius.",org.govmu.emergencyalert
Emergency Alerts,"You can send your current location details in S.M.S to your relatives and friends. They can easily find the message while in offline also. You need not to give location permissions to this app at installation time. You have to give permission at the emergency time only. Add 5 members contacts which you want to message your location details if you feel Insecurity. and you can send the message as many as you want. in one click it will send 5 members.  They can check your location in maps and find rout to your location. you can send multiple times,when you are in running. multiple location will send to 5 contacts. they can easily find where your current location.",com.Changeworld.emergencyalert
Emergency Broadcast System,App to receive emergency alerts on your phone,com.linconsulo.dev.ebs
Emergency chat,"Emergency chat can be used in any situation where speech is impossible but communication is still necessary.\r\nThe splash screen has a base text that explains to the person you gave your phone to that you can't use speech and want to use this app to communicate. The default text is aimed at people experiencing an autistic meltdown, where their speech centres stay non-functional for a while even after they've recovered.\r\n\r\nBoth the title and text can be adjusted in the settings to be whatever you want the person you give your phone to to know.\r\n\r\nYou can then continue to the next screen which has a simple chat client.\r\n\r\nFind us on facebook: http://facebook.com/emergencychatapp\r\n\r\nIcon copyright Kyo-Tux (http://kyo-tux.deviantart.com/)",com.jeroendebusser.aspiemeltdown
Emergency Contact,"The Emergency Contact app for Android tablets is the perfect app for anyone in trouble and needing help. The app allows you to send a customized emergency message by email to your emergency contacts. The app includes an emergency flasher, emergency alarm, and emergency flashlight. You configure the app by entering your personal, medical, and/or insurance information, your customized emergency message, and your emergency contacts. Save your input data by using the Save button. Load your currently saved data by using the Load button. Delete your currently saved data by using the Delete button. \r\n\r\nYour personal, medical, and/or insurance information is sent to your emergency contacts along with your approximate location when you press and hold the SOS button for 3 seconds in the app. This app is perfect for parents, children, older adults, people with medical conditions, or anyone concerned about safety.\r\n\r\nThe app's settings are used to modify the emergency flasher colors and the strobe/blinking rate, and to select the emergency alarm sound such as air raid, siren, fire smoke alarm, etc.\r\n\r\nSending the emergency message requires an internet connection and valid email addresses for you and your contacts. Including your approximate location in the emergency message requires that your device have location-based services that are available and enabled, and have a location data provider that is a cellular network-based or a GPS provider.\r\n\r\nAny data that you enter into the app is only stored on your device. Made Easy Enterprises LLC respects your privacy. No data entered into this app will be disclosed, sold, or rented to third parties.\r\n\r\nIt is recommended that you notify your emergency contacts that they will receive an emergency message from you when you need help. It is also recommended that you test this app by sending a test message to your emergency contacts to ensure that they receive the test message.\r\n\r\nSending the emergency message should be used carefully and only when you need help. If you have an emergency call 911 first. This app is not a substitute for any emergency service such as 911, police, fire, ambulance, etc.\r\n\r\nRequirements and Permissions:\r\n\r\nThe current release supports Android tablets that are 7"" to 10"" with Android OS 4.0 and up.\r\n\r\nOn Android devices with GPS or cellular network-based the app uses location information to provide your emergency contacts with your approximate location. On Android devices with internet connection the app sends your emergency message to your emergency contacts. On Android devices with camera hardware the app uses the camera flash.",com.madeeasyenterprises.emergencycontact
Emergency Contact Data,"<b>International Personal Medical Health Record Profile Viewer - In Case of Emergency & Every-day Use with Phone & Tablet</b>\r\n\r\n<i>Available in English</i>\r\n\r\nFor Registered Members\r\n\r\nThe Emergency Contact Data Profile Viewer displays your critical medical record information that is stored on your device within 5 seconds, worldwide, 24/7, without the Internet. This is the exact information that hospitals and doctors say we need with us at all times. The Profile Viewer can speak for you when you are in shock, confused or unconscious. \r\n\r\nThe immediate display helps first responders and medical personnel provide the most definitive care possible. This ensures you of the best medical outcomes which can save your life. The very best medical outcomes also reduce your short and long-term medical expenses. When you receive the best medical outcomes you also realize your best long-term quality of life free from chronic illnesses and disabilities.\r\n\r\nThe Profile Viewer can also be used for non-emergency situations such as when speaking with a pharmacist, doctor or when completing medical forms. A font enlargement feature is provided to facilitate viewing. You can add notes throughout your entire medical record. \r\n\r\n<b>Your Medical Profile Includes Unlimited Entries:</b> \r\n<b>Medical & Mental Health Alerts</b> \r\n<b>Organ Donor Alert</b> \r\n<b>Emergency Contacts</b> – With Contact Information \r\n<b>Physicians</b> – With Office Contact Information \r\n<b>Medications</b> – Frequency and Dosage \r\n<b>Medical Conditions</b>\r\n<b>Surgeries & Procedures</b> \r\n<b>Recent Treatments</b> \r\n<b>Allergies</b> – Drug, Material, Food, Environmental, and Other \r\n<b>Vaccinations</b> \r\n<b>Health and Prescription Coverage</b> – Insurance and RX Plans, plus Contact Information",com.EmergencyContactData
Emergency Management Suite,"An Emergency Safety app designed to help school and business staff respond safely and effectively during drills and emergencies. The various components of the app address different safety needs including step-by-step emergency response procedures using the following features:\r\n\r\n- Real-time Emergency Response Flipcharts put emergency procedures front and center, providing staff with immediate access to the steps to handle various situations.\r\n\r\n- For schools, Respond empowers staff to account for students, by name, during drills and emergencies. Personnel can instantly view building and class roster information that is synced with the school’s Student Information System (SIS).",com.navigateemergencymanagementsuite
Emergency Plus,"Save the app that could save your life – Emergency Plus.\r\n \r\nIn an emergency, time and location accuracy are critical. By downloading the ‘Emergency +’ app, you’ll equip yourself with a powerful tool that will help you call Triple Zero (000) quickly, and allow you to accurately communicate your location to emergency call-takers.\r\n \r\n‘Emergency +’ is a national app developed by Australia’s emergency services and their government industry partners, helping people to call the right number at the right time, anywhere in Australia. Emergency + also includes SES and Police Assistance Line numbers as options, so non-emergency calls are made to the most appropriate number.\r\n \r\nWhen calling Triple Zero (000), remember to stay focused, stay relevant and stay on the line. Before you call ask yourself:\r\n \r\n* Is someone seriously injured or in need of urgent medical help?\r\n* Is your life or property being threatened?\r\n* Have you just witnessed a serious accident or crime?\r\n \r\nIf you answered ‘Yes’ to any of these questions, call Triple Zero (000). Triple Zero (000) calls are free.\r\n \r\nThe app uses a mobile phone’s GPS functionality and what3words, so callers can provide emergency call-takers with their location information as determined by their smart phone.\r\n \r\nWith what3words available within the Emergency+ app, Triple Zero (000) callers can confirm their exact location quickly and accurately.\r\nwhat3words has divided the world into 3m squares and given each one a unique three word identifier. Addressing using what3words works offline - ideal when you have no data coverage or are in a remote location.\r\n\r\nImportant – if there is no mobile coverage on any network, you will not be able to reach the Emergency Call Service via a mobile telephone​​.",com.threesixtyentertainment.nesn
Emergency preparedness & Disas,"•  How to survive earthquakes, tsunamis, tornadoes & hurricanes  \r\n•  Finding safe drinking water & complete water purification guide \r\n•  Building robust, safe temporary shelters & making fire \r\n•  Rescue SOS & emergency response tips \r\n•  Comprehensive 72 hour survival kit guide & checklist \r\n•  Body temperature regulation & first aid  \r\n•  How to protect yourself from nuclear (radioactive) fallout \r\n•  What to do when lightning strikes \r\n•  How to escape wildfires, forest fires \r\n•  How to prepare for and survive blizzards & extreme cold weather \r\n•  How to survive an airplane crash landing \r\n•  When to escape and be rescued from a sinking ship \r\n•  What to do in the event of a rail or subway accident \r\n•  How to escape a fire in a high-rise building \r\n\r\n💡 <b>THE MOST COMPLETE EMERGENCY PREPAREDNESS MANUAL</b> \r\n\r\nWith high-quality illustrations & animations, you will learn what to do in the event a disaster or emergency situation occurs. Including 17 guides for earthquakes, tornadoes & many different accidents, emergency response tips, survival tools & guides. \r\n \r\n🔦 <b>VERSATILE & HELPFUL</b>\r\n\r\nFrom wildfires and tsunamis to airplane crash and nuclear fallout, this survival assistance app is the most comprehensive disaster and emergency situation preparation guide, designed to do one thing – keep you safe in the hardest, life-endangering moments. \r\n \r\n🔖 <b>COVERS NUMEROUS SITUATIONS & SCENARIOS </b>\r\n\r\nYou could be anywhere when disaster strikes – at home, in a shopping mall or driving to work. Find the situation and follow instructions. This emergency survival manual app covers different situations and the best course of action to take in full detail.\r\n \r\n💡 <b>LEARN & PREPARE</b>\r\n\r\nKnow how to prep your home for an earthquake, survive nuclear fallout, build a temporary shelter, purify water, stay safe when the grid goes down and much more. You can even save and manage your own custom survival kit checklist! \r\n \r\n🔦 <b>EASY TO FOLLOW HANDBOOK</b>\r\n \r\nWe've included professional illustrations and animations to accompany the emergency survival instructions. No other manual makes it so easy for you to learn exactly what you need to do in a disaster situation. See why we are one of the best universal survival handbook and disaster preparedness apps. \r\n \r\n🔖 <b>YOU WILL LEARN:</b>\r\n \r\n• How to prepare yourself and your environment for an emergency situation or disaster\r\n• The best course of action to take based on your current situation\r\n• How to survive in any disaster, whether it is natural or urban\r\n• The equipment you should have to improve your chance of survival and how to use it\r\n• Lifesaving advice and tips to help protect yourself and others around you \r\n  \r\n  \r\n<b>THE ULTIMATE GUIDE TO EMERGENCY PREPAREDNESS </b>  \r\n\r\nDownload the easy-to-use, neatly explained, the most complete natural & urban disaster survival manual! 💠 FREE trial \r\n\r\nWith an extensive range of in-depth chapters in the disaster survival & emergency situation preparedness guide, you'll find useful knowledge on every page which could one day save your life, or help you save somebody else's.",com.emergency.disaster_survival
Emergency Ready App,"This Service provides emergency shelters for safe evacuation in case of disaster and First aid. \r\n\r\n1. Search Shelter \r\n- Shelters across the country, you can search for location information. \r\n\r\n2. Emergency Medical Centers \r\n- Emergency Medical Centers across the country, you can search for location information. \r\n\r\n3. Fire Stations \r\n- Fire Stations Emergency Medical Centers across the country, you can search for location information. \r\n\r\n4. Police Stations \r\n- Police Stations across the country, you can search for location information. \r\n\r\n5. Safety Guide \r\n- CPR for infants, CPR for Adults, First Aid(Burn injuries from fires), Fire Extinguisher& indoor fire hydrant \r\n\r\n6. 119 Emergency Call (Direct Call)",kr.go.nema.disasteralert_eng
Emergency Response Manager,"App Description Section:\r\nThe official Emergency Response Manager (ERM) app for Android phones and tablets to be used in conjunction with the Emergency Response Manager system.  As part of a real-time managing system, the app has been providing SAR organizations a platform to Manage, Communicate, and Coordinate resources and information flow during search and rescue missions since 2015.\r\n \r\nMission Management Overview:\r\nPassive Resource Management\r\nAlert and activate resources\r\nReal time data for decision making and risk management\r\nDetailed information to understand the big picture\r\n \r\nProduct Highlights:\r\nEnables organization members to receive mission alerts, respond and navigate to the staging area, and be tracked in the field.\r\nProvides a customizable platform to help users link to resources, organization contact information, certification status, and much more.",com.emergencyresponsemanager.response
Emergency - American Red Cross,"Download Emergency!, an all-hazard app, by the American Red Cross. Receive accurate information on time to protect yourself and your loved ones. \r\n•        App is free and available in English with a Spanish-language toggle.\r\n•        Monitor alerts for severe weather, including tornadoes, hurricanes, floods, and many more. \r\n•        Improved alert speed. \r\n•        Customize your alerts and push notifications. \r\n•        Enable critical alerts that can override the Do Not Disturb mode on your device. \r\n•        Find open Red Cross shelters with our interactive map.\r\n•        Map overlays include Hurricane Tracker, Radar, Satellite, Clouds, Rain, Wind Speed, Snow\r\n•        Access Red Cross safety content even without mobile connectivity.",com.cube.arc.hzd
EMS Pocket Prep,"Hundreds of exam practice questions at your fingertips. We are Pocket Prep, makers of high-quality exam prep built by industry experts and designed to help you pass your exam. \r\n\r\nEMS Pocket Prep gives you access to study prep for 6 different emergency services exams all in one place, with 500-1000 practice questions for each exam.\r\n\r\n---\r\n\r\nPocket Prep is always free to download and try. We have two study options: \r\n\r\n- FREE Basic Prep includes 20-60 practice questions and 3 out of 6 study modes including Question of the Day, Quick 10, and Timed Quiz.\r\n\r\n- PREMIUM Prep includes the full question bank (500+ per exam) and all 6 study modes including Weakest Subject, Missed Questions, and Build Your Own Quiz. Premium also comes with a Pass Guarantee!\r\n\r\n---\r\n\r\nStudy Features Include:\r\n\r\nStart Studying\r\n- 6 different quiz modes\r\n- Answer explanations & textbook references for each question\r\n\r\nAssess Your Performance\r\n- Keep track of your overall study metrics for all your answered questions \r\n- Subject scores tell you which exam subjects need more focus\r\n- Community score shows how you compare to other learners \r\n- Study progress shows how many questions are left in your study bank\r\n\r\nReview Your Activity\r\n- Easily find any answered question, explanation, or reference with search & filter options\r\n- Sort by flagged or incorrect questions\r\n\r\n---\r\n\r\nPocket Prep has been helping people pass their exams since 2011. Our exam prep content is created using subject matter experts to craft fully original practice questions that are directly based off each individual exam blueprint and cover each section of the exam. Our proprietary sourcePrep™ process ensures these experts are trained in writing techniques that reflect current industry testing standards and practices. \r\n\r\nScientific research shows that studying in short bursts over time is more effective than a handful of long study sessions. Our app is built with this in mind, giving you the power to study from your phone whenever and wherever it's convenient for you. Easily access practice questions while waiting in line, on public transit, on meal breaks, and more! \r\n\r\nPocket Prep's apps are award-winning:\r\n- Intelligent.com's Best TEAS Prep Courses, 2021\r\n- Twinkl's Top EdTech Tool, 2020\r\n- EdTech Digest's Cool Tool Award, 2016\r\n\r\n---\r\n\r\nSubscription Pricing:\r\n\r\nWe offer three auto-renewing options. There is no increase in price when renewing.\r\n- $14.99/Monthly\r\n- $35.99/Quarterly\r\n- $89.99/Yearly\r\n\r\n---\r\n\r\nIt's your turn now. You got this!",com.pocketprep.android.ems
EQInfo,"EQInfo shows earthquake information world-wide. Information can be filtered by region, magnitude and agency. It provides system notifications and social media sharing options.\r\n\r\nEQInfo was conceived and implemented by the expert developers of SeisComP3, http://www.gempa.de, a software platform used by most geophysical institutes in the world to automatically detect and locate earthquakes.\r\n\r\nEQInfo integrates seamlessly with your Raspberry Shake personal seismograph, http://raspberryshake.org, to bring you up-to-the-minute earthquake announcements including waveform snippets from your very own Raspberry Shake. In doing so, EQInfo accesses the largest IoT citizen-scientist earthquake detection network in the world to bring you high fidelity earthquake information, http://raspberryshake.net/stationview/.\r\n\r\nEQInfo now lets you submit ""Did you feel it"" reports from your mobile device. In doing so, everyone can help to better assess the impact that an earthquake might have in their community.\r\n\r\nThe following features are supported:\r\n\r\n1. List of latest earthquakes showing magnitude, region, origin time, direction/distance to the earthquake epicenter and earthquake monitoring agency\r\n2. Earthquake details including overview map and multiple solutions from different agencies\r\n3. Map of latest earthquakes\r\n4. Submission and displaying of felt-reports\r\n5. Visualization of earthquake waveforms from the Raspberry Shake network\r\n6. Sharing of event information via social media\r\n7. Define multiple filters for the earthquake information, filter by magnitude, depth, time and region\r\n8. Configuration of data sources, update intervals, geolocation and unit of measurement\r\n9. Background updates and notifications\r\n\r\nThe following agencies provide information to EQInfo:\r\n\r\n- Raspberry Shake Citizen-Scientist Network, http://raspberryshake.org\r\n- GFZ German Research Centre for Geosciences, http://geofon.gfz-potsdam.de\r\n- European-Mediterranean Seismological Centre (EMSC), http://www.emsc-csem.org\r\n- United States Geological Survey (USGS), http://www.usgs.gov\r\n- Indonesian Agency for Meteorology, Climatology and Geophysics (BMKG), http://inatews.bmkg.go.id\r\n- Natural Resources Canada (NRCan), http://earthquakescanada.nrcan.gc.ca\r\n- Spanish National Geographic Institute (IGN), http://www.ign.es\r\n- National Observatory of Athens (NOA, Greece), http://www.noa.gr\r\n- Kandilli Observatory and Earthquake Research Institute (KOERI, Turkey), http://www.koeri.boun.edu.tr\r\n- GNS Science New Zealand, http://www.gns.cri.nz\r\n- Bureau of Economic Geology, University of Texas at Austin (TexNet), http://www.beg.utexas.edu\r\n- Hessian State Office for Conservation, Environment and Geology (HLNUG), https://www.hlnug.de\r\n- School and Observatory of Earth Sciences (EOST, France), https://eost.unistra.fr\r\n- Swiss Seismological Service (SED), http://www.seismo.ethz.ch\r\n- National Center for Seismology, Ministry of Earth Sciences (NCS, India), http://www.imd.gov.in\r\n- Seismology in Central Germany (SIM), http://antares.thueringen.de/cadenza/seismo\r\n\r\n\r\nA priority list for the agencies can be defined, taking care of the aggregation of information.\r\n\r\nEQInfo tries to minimize both the data volume and update time. Push messages are used if supported by the data provider.\r\n\r\nThe gempa team like to thank all users which provided feedback and thus helped to improve this App. \r\n\r\nTranslations are mostly done by using Googles automatic translation.\r\nIf you are a native speaker and want to help us by providing some translations, please feel free to contact us at any time!",de.gempa.android.eqinfo
